1)
2)insert into employee values(&empid,&empname,&empsal);
3)select *from employee;
4) insert into employee(empid,empsal)values(11,12000);
5) select empid,empsal from employee;
6)select *from employees;
7)select *from employees where empid=5;
8)
SQL> select empid,empsal,empsal+500 from employee;
9)select empid,empsal "oldsal",empsal+500 "newsal" from employee
;
10)
SQL> select *from dual;

D
-
X

SQL> select 25/5 from dual;

      25/5
----------
         5
11)select sysdate from dual;

SYSDATE
---------
27-OCT-23

SQL>


12)select *from employee where empid=8 and empsal=65000;


     EMPID EMPNAM     EMPSAL
---------- ------ ----------
         8 veni        65000

SQL> select *from employee where empid=11 or empsal=89000;


     EMPID EMPNAM     EMPSAL
---------- ------ ----------
         9 swa         89000
        11             12000

SQL> select *from employee where empid=11 or empsal=89000;


13)select *from employee where not(empsal<50000);

     EMPID EMPNAM     EMPSAL
---------- ------ ----------
         2 sai         60000
         3 satyam     140000
         5 laxman      50000
         8 veni        65000
         9 swa         89000


14)select *from employee where (empsal<30000);

     EMPID EMPNAM     EMPSAL
---------- ------ ----------
        10 vihaan      23000
        11             12000

SQL> select *from employee where (empsal>30000);

     EMPID EMPNAM     EMPSAL
---------- ------ ----------
         2 sai         60000
         3 satyam     140000
         4 hari        40000
         5 laxman      50000
         6 sita        35000
         7 gow         45000
         8 veni        65000
         9 swa         89000


15)select *from employee where empnam like 's%';

16)QL> truncate table study;

Table truncated.

SQL> select *from study;

no rows selected

SQL> desc study;
 Name                                      Null?    Type
 ----------------------------------------- -------- ----------------------------
 ROLLNUMBER                                         NUMBER(3)
 STUDENT_NA                                         VARCHAR2(6)
 AGE                                                NUMBER(2)
 MARKS                                              NUMBER(5)
 ADDR                                               VARCHAR2(10)
 KOTI                                               VARCHAR2(10)
 KOKO                                               VARCHAR2(10)
 KOJI                                               VARCHAR2(10)
 INFORMATION                                        VARCHAR2(10)



17)
SQL> alter table employee add(names varchar(6));

Table altered.

SQL> select *from employee;

     EMPID EMPNAM     EMPSAL NAMES
---------- ------ ---------- ------
         1 koti        30000
         2 sai         60000
         3 satyam     140000
         4 hari        40000
         5 laxman      50000
         6 sita        35000
         7 gow         45000
         8 veni        65000
         9 swa         89000
        10 vihaan      23000
        11             12000
18)update employee set names='kalyan' where empid=2;

1 row updated.

SQL> update employee set names='sai' where empid=3;

1 row updated.

SQL> update employee set names='satyam' where empid=4;

1 row updated.

SQL> update employee set names='hari' where empid=5;

1 row updated.

SQL> update employee set names='pandu' where empid=6;

1 row updated.

SQL> update employee set names='vihaan' where empid=7;

1 row updated.

SQL> update employee set names='veni' where empid=8;

1 row updated.

SQL> update employee set names='gowtham' where empid=9;
update employee set names='gowtham' where empid=9
                          *
ERROR at line 1:
ORA-12899: value too large for column "KOTI"."EMPLOYEE"."NAMES" (actual: 7,
maximum: 6)


SQL> /
update employee set names='gowtham' where empid=9
                          *
ERROR at line 1:
ORA-12899: value too large for column "KOTI"."EMPLOYEE"."NAMES" (actual: 7,
maximum: 6)


SQL> update employee set names='gani' where empid=9;

1 row updated.

SQL> update employee set names='koii' where empid=10;

1 row updated.

SQL>


19) alter table employee modify addr char(10);

Table altered.




19)alter table employee rename to employees;

Table altered.

SQL> select *from employee;
select *from employee
             *
ERROR at line 1:
ORA-00942: table or view does not exist


SQL> select *from employees;

     EMPID EMPNAM     EMPSAL NAMES  PHONENUMBER ADDR              AGE
---------- ------ ---------- ------ ----------- ---------- ----------
         1 koti        30000 koti    1234567890                    23
         2 sai         60000 kalyan  9381592436                    24
         3 satyam     140000 sai     7989527928                    25
         4 hari        40000 satyam  9359881223                    26
         5 laxman      50000 hari    8374323503                    27
         6 sita        35000 pandu   9705550881                    28
         7 gow         45000 vihaan  9948219377                    29
         8 veni        65000 veni    9347587455                    30
         9 swa         89000 gani    9951453021                    31
        10 vihaan      23000 koii    9876543212                    22
        11             12000 swa     8184232323                    23

11 rows selected.

SQL>



20)QL> alter table employees rename column phonenumber to phno;

Table altered.

SQL> select *from employees;

     EMPID EMPNAM     EMPSAL NAMES        PHNO ADDR              AGE
---------- ------ ---------- ------ ---------- ---------- ----------
         1 koti        30000 koti   1234567890                    23
         2 sai         60000 kalyan 9381592436                    24
         3 satyam     140000 sai    7989527928                    25
         4 hari        40000 satyam 9359881223                    26
         5 laxman      50000 hari   8374323503                    27
         6 sita        35000 pandu  9705550881                    28
         7 gow         45000 vihaan 9948219377                    29
         8 veni        65000 veni   9347587455                    30
         9 swa         89000 gani   9951453021                    31
        10 vihaan      23000 koii   9876543212                    22
        11             12000 swa    8184232323                    23

11 rows selected.

SQL>


21) alter table employees rename to emp;

Table altered.

SQL> select *from emp;

     EMPID EMPNAM     EMPSAL NAMES        PHNO ADDR              AGE
---------- ------ ---------- ------ ---------- ---------- ----------
         1 koti        30000 koti   1234567890                    23
         2 sai         60000 kalyan 9381592436                    24
         3 satyam     140000 sai    7989527928                    25
         4 hari        40000 satyam 9359881223                    26
         5 laxman      50000 hari   8374323503                    27
         6 sita        35000 pandu  9705550881                    28
         7 gow         45000 vihaan 9948219377                    29
         8 veni        65000 veni   9347587455                    30
         9 swa         89000 gani   9951453021                    31
        10 vihaan      23000 koii   9876543212                    22
        11             12000 swa    8184232323                    23

11 rows selected.

SQL> alter table employees rename to emp;

Table altered.

SQL> select *from emp;

     EMPID EMPNAM     EMPSAL NAMES        PHNO ADDR              AGE
---------- ------ ---------- ------ ---------- ---------- ----------
         1 koti        30000 koti   1234567890                    23
         2 sai         60000 kalyan 9381592436                    24
         3 satyam     140000 sai    7989527928                    25
         4 hari        40000 satyam 9359881223                    26
         5 laxman      50000 hari   8374323503                    27
         6 sita        35000 pandu  9705550881                    28
         7 gow         45000 vihaan 9948219377                    29
         8 veni        65000 veni   9347587455                    30
         9 swa         89000 gani   9951453021                    31
        10 vihaan      23000 koii   9876543212                    22
        11             12000 swa    8184232323                    23

11 rows selected.

SQL>


22)create table empo(empid number(5),empsal number(6),names varchar2(6));

Table created.

SQL> insert into empo(empid,empsal,names) select empid,e
mpsal,names from emp;

11 rows created.

SQL> select *from empo;

     EMPID     EMPSAL NAMES
---------- ---------- ------
         1      30000 koti
         2      60000 kalyan
         3     140000 sai
         4      40000 satyam
         5      50000 hari
         6      35000 pandu
         7      45000 vihaan
         8      65000 veni
         9      89000 gani
        10      23000 koii
        11      12000 swa

11 rows selected.


23)update empo set empsal=30000;

11 rows updated.

SQL>  select *from empo;

     EMPID     EMPSAL NAMES
---------- ---------- ------
         1      30000 koti
         2      30000 kalyan
         3      30000 sai
         4      30000 satyam
         5      30000 hari
         6      30000 pandu
         7      30000 vihaan
         8      30000 veni
         9      30000 gani
        10      30000 koii
        11      30000 swa

11 rows selected.




24)not null unique 




SQL> create table stu(sid number(6) not null,sname varchar2(
10) not null,addr varchar2(10));

Table created.

SQL> select *from stu;

no rows selected

SQL> desc stu;
 Name                                      Null?    Type
 ----------------------------------------- -------- ----------------------------
 SID                                       NOT NULL NUMBER(6)
 SNAME                                     NOT NULL VARCHAR2(10)
 ADDR                                               VARCHAR2(10)

SQL> insert into stu(sid,sname,addr)values (1,'koti','dmd');


1 row created.

SQL> /

1 row created.

SQL> insert into stu(sid,sname,addr)values (1,null,'dmd');
insert into stu(sid,sname,addr)values (1,null,'dmd')
                                         *
ERROR at line 1:
ORA-01400: cannot insert NULL into ("KOTI"."STU"."SNAME")


SQL> insert into stu(sid,sname,addr)values (2,'koti','dmd');

1 row created.

SQL> insert into stu(sid,sname,addr)values (3,null,'dmd');
insert into stu(sid,sname,addr)values (3,null,'dmd')
                                         *
ERROR at line 1:
ORA-01400: cannot insert NULL into ("KOTI"."STU"."SNAME")


SQL> insert into stu(sid,sname,addr)values (1,'koti',null);

1 row created.

SQL> select *from stu;

       SID SNAME      ADDR
---------- ---------- ----------
         1 koti       dmd
         1 koti       dmd
         2 koti       dmd
         1 koti

SQL> /

       SID SNAME      ADDR
---------- ---------- ----------
         1 koti       dmd
         1 koti       dmd
         2 koti       dmd
         1 koti

SQL> create table abc(sid number unique,sname varchar2(10) n
ot null,age number(3) not null check(age>=18));

Table created.

SQL> insert into abc(sid,sname,age) values(1,'koti',19);

1 row created.

SQL> insert into abc(sid,sname,age) values(2,'koti',20);

1 row created.

SQL> insert into abc(sid,sname,age) values(3,'koti',17);
insert into abc(sid,sname,age) values(3,'koti',17)
*
ERROR at line 1:
ORA-02290: check constraint (KOTI.SYS_C004070) violated


SQL> insert into abc(sid,sname,age) values(1,'koti',19);
insert into abc(sid,sname,age) values(1,'koti',19)
*
ERROR at line 1:
ORA-00001: unique constraint (KOTI.SYS_C004071) violated


SQL> select *from abc;

       SID SNAME             AGE
---------- ---------- ----------
         1 koti               19
         2 koti               20

SQL>




25)default 




 alter table abc add(addr varchar2(10) default 'dmd');

Table altered.

SQL> select *from abc;

       SID SNAME             AGE ADDR
---------- ---------- ---------- ----------
         1 koti               19 dmd
         2 koti               20 dmd





 insert into abc(sid,sname,age) values(3,'koti',22);

1 row created.

SQL> select *from abc;

       SID SNAME             AGE ADDR
---------- ---------- ---------- ----------
         1 koti               19 dmd
         2 koti               20 dmd
         3 koti               22 dmd

SQL> insert into abc(sid,sname,age,addr) values(4,'koti',22,null);

1 row created.

SQL> select *from abc;

       SID SNAME             AGE ADDR
---------- ---------- ---------- ----------
         1 koti               19 dmd
         2 koti               20 dmd
         3 koti               22 dmd
         4 koti               22

SQL>